{"$schema":"https://json-schema.org/draft/2020-12/schema","$id":"https://ndoracle.org/schema/types/perspective-v0.2.json","title":"ND Oracle perspective object v0.2","type":"object","additionalProperties":false,"required":["schema_version","id","type","status","provenance","held_by","position","reasoning","supporting_material_refs","disagreement_refs","scope"],"properties":{"schema_version":{"const":"0.2"},"id":{"$ref":"https://ndoracle.org/schema/common-v0.2.json#/$defs/identifier"},"type":{"const":"perspective"},"status":{"$ref":"https://ndoracle.org/schema/common-v0.2.json#/$defs/status"},"provenance":{"$ref":"https://ndoracle.org/schema/common-v0.2.json#/$defs/provenance"},"held_by":{"type":"object","additionalProperties":false,"required":["name","scope"],"properties":{"name":{"$ref":"https://ndoracle.org/schema/common-v0.2.json#/$defs/nonBlankString"},"scope":{"$ref":"https://ndoracle.org/schema/common-v0.2.json#/$defs/nonBlankString"}}},"position":{"$ref":"https://ndoracle.org/schema/common-v0.2.json#/$defs/nonBlankString"},"reasoning":{"$ref":"https://ndoracle.org/schema/common-v0.2.json#/$defs/nonBlankString"},"supporting_material_refs":{"type":"array","items":{"$ref":"https://ndoracle.org/schema/common-v0.2.json#/$defs/typedReference"}},"disagreement_refs":{"type":"array","items":{"$ref":"https://ndoracle.org/schema/common-v0.2.json#/$defs/typedReference"}},"scope":{"$ref":"https://ndoracle.org/schema/common-v0.2.json#/$defs/nonBlankString"}}}