{"schema_version":"0.2","id":"fixture-perspective","type":"perspective","status":"draft","held_by":{"name":"Synthetic fixture authors","scope":"Only the automated test fixture."},"position":"The fixture perspective is represented as an attributed position, not a fact.","reasoning":"It exists to test the Perspective contract.","supporting_material_refs":[{"type":"evidence","id":"fixture-evidence"}],"disagreement_refs":[],"scope":"Synthetic validation only.","provenance":{"created":"2026-08-11","created_by":"test fixture","method":"Synthetic test-only fixture","review_state":"unreviewed_seed","last_reviewed":null}}